{
  "eventId": "00000000-0000-4000-8000-000000000101",
  "sourceEventId": null,
  "personaId": "gentle-companion",
  "mode": "conversation",
  "priority": 100,
  "expiresAt": "2026-08-11T12:00:30Z",
  "speech": {"text": "我在这里陪你。", "emotion": "warm", "interruptible": true},
  "innerOs": {"text": "先用一句话回应，再把动作交给设备。", "durationMs": 4000, "anchor": "robot"},
  "robot": {"actions": [{"intent": "nod", "parameters": {}}]},
  "xr": {"visible": true, "mode": "inner-os"},
  "app": {"refresh": true, "section": "home"},
  "interruptible": true
}
